{
  "schema": "smart-delegate.registry.v1",
  "updatedAt": "2026-09-29",
  "notes": "Seed priors only. Every score below is a hand-set starting point (source: manual-seed, low confidence), not a benchmark. Override them in ~/.smart-delegate/models.json or .smart-delegate/models.json; local history adjusts reliability over time. Model ids are limited to values verified against the installed CLI help: Claude aliases from `claude --help`; Codex and Command Code use the agent's own configured default (model: null) until `smart-delegate models --discover` finds real ids. Claude context windows are left unknown: aliases move between model versions, so they are filled from the pi-ai catalog once a run has reported the real model id (`smart-delegate models --catalog --save`).",
  "models": [
    {
      "id": "claude/fable",
      "agent": "claude",
      "provider": "anthropic",
      "model": "fable",
      "enabled": true,
      "status": "stable",
      "local": false,
      "contextWindow": null,
      "vision": true,
      "costTier": 5,
      "costPerTaskUsd": null,
      "source": "manual-seed",
      "confidence": 0.3,
      "capabilities": {
        "coding": 0.93,
        "reasoning": 0.96,
        "reliability": 0.92,
        "quality": 0.94,
        "architecture": 0.95,
        "toolUse": 0.92,
        "speed": 0.35
      }
    },
    {
      "id": "claude/opus",
      "agent": "claude",
      "provider": "anthropic",
      "model": "opus",
      "enabled": true,
      "status": "stable",
      "local": false,
      "contextWindow": null,
      "vision": true,
      "costTier": 4,
      "costPerTaskUsd": null,
      "source": "manual-seed",
      "confidence": 0.3,
      "capabilities": {
        "coding": 0.92,
        "reasoning": 0.94,
        "reliability": 0.92,
        "quality": 0.92,
        "architecture": 0.93,
        "toolUse": 0.92,
        "speed": 0.45
      }
    },
    {
      "id": "claude/sonnet",
      "agent": "claude",
      "provider": "anthropic",
      "model": "sonnet",
      "enabled": true,
      "status": "stable",
      "local": false,
      "contextWindow": null,
      "vision": true,
      "costTier": 3,
      "costPerTaskUsd": null,
      "source": "manual-seed",
      "confidence": 0.3,
      "capabilities": {
        "coding": 0.89,
        "reasoning": 0.86,
        "reliability": 0.88,
        "quality": 0.86,
        "architecture": 0.82,
        "toolUse": 0.9,
        "speed": 0.7
      }
    },
    {
      "id": "claude/haiku",
      "agent": "claude",
      "provider": "anthropic",
      "model": "haiku",
      "enabled": true,
      "status": "stable",
      "local": false,
      "contextWindow": null,
      "vision": true,
      "costTier": 1,
      "costPerTaskUsd": null,
      "source": "manual-seed",
      "confidence": 0.3,
      "capabilities": {
        "coding": 0.74,
        "reasoning": 0.7,
        "reliability": 0.78,
        "quality": 0.7,
        "architecture": 0.6,
        "toolUse": 0.8,
        "speed": 0.9
      }
    },
    {
      "id": "codex/default",
      "agent": "codex",
      "provider": "openai",
      "model": null,
      "enabled": true,
      "status": "stable",
      "local": false,
      "contextWindow": null,
      "vision": true,
      "costTier": 3,
      "costPerTaskUsd": null,
      "source": "manual-seed",
      "confidence": 0.2,
      "capabilities": {
        "coding": 0.9,
        "reasoning": 0.87,
        "reliability": 0.88,
        "quality": 0.87,
        "architecture": 0.83,
        "toolUse": 0.88,
        "speed": 0.6
      }
    },
    {
      "id": "command-code/default",
      "agent": "command-code",
      "provider": "commandcode",
      "model": null,
      "enabled": true,
      "status": "stable",
      "local": false,
      "contextWindow": null,
      "vision": null,
      "costTier": 2,
      "costPerTaskUsd": null,
      "source": "manual-seed",
      "confidence": 0.2,
      "capabilities": {
        "coding": 0.82,
        "reasoning": 0.78,
        "reliability": 0.8,
        "quality": 0.78,
        "architecture": 0.72,
        "toolUse": 0.82,
        "speed": 0.65
      }
    },
    {
      "id": "deepseek-harness/default",
      "agent": "deepseek-harness",
      "provider": null,
      "model": null,
      "enabled": true,
      "status": "experimental",
      "local": false,
      "contextWindow": null,
      "vision": null,
      "costTier": 1,
      "costPerTaskUsd": null,
      "source": "manual-seed",
      "confidence": 0.1,
      "notes": "The harness's own configured default model (agent-default-model row). Experimental until rated; import real provider/model pairs with `smart-delegate models --catalog`.",
      "capabilities": {
        "coding": 0.8,
        "reasoning": 0.78,
        "reliability": 0.78,
        "quality": 0.76,
        "architecture": 0.7,
        "toolUse": 0.8,
        "speed": 0.7
      }
    }
  ]
}
